8832033.0,IVAN MOSHLYAK,Fishing Vessel,918.0,914.0,1990.0,Mongolia,Russia,Dalrybprom JSC,Russia,Dalrybprom JSC,Dalrybprom JSC,Russia,Alang,India,2024-09-01,,
7913622.0,DIVO,Fish Factory Ship,49367.0,26136.0,1980.0,Comoros,Russia,Pacific Marine Trawlers Co Ltd,Russia,Pacific Marine Trawlers Co Ltd,Pacific Marine Trawlers Co Ltd,Russia,Alang,India,2024-10-01,,
9120281.0,HUMPBACK WHALE,Fish Factory Ship,4407.0,3869.0,1994.0,Guinea False,Russia,Forpost LLC,Russia,Forpost LLC,Forpost LLC,Russia,Alang,India,2024-12-01,,
8228684.0,PORFIRIY CHANCHIBADZE,Fish Factory Ship,4407.0,3910.0,1984.0,Russia,,Soyuznyye Rybnyye Promysly,Russia,Soyuznyye Rybnyye Promysly,Soyuznyye Rybnyye Promysly,Russia,Alang,India,2024-12-01,,
8313879.0,BUKHTA NAGAEVA,Refrigerated Cargo Ship,3226.0,2353.0,1984.0,Eswatini False,Russia,MAG-SEA International,Russia,MAG-SEA International,MAG-SEA International,Russia,Gadani,Pakistan,2024-02-01,,
7330038.0,ERMAK,Icebreaker,14058.0,12687.0,1974.0,Russia,,Russia Govt,Russia,Rosmorport SPB Branch,Russia Govt,Russia,St Petersburg,Russia,2024-01-01,,
7643124.0,DIOMEDES,Fishing Vessel,825.0,944.0,1976.0,Russia,,Arcticservice,Russia,Arcticservice,Arcticservice,Russia,Murmansk,Russia,2024-05-01,,
8230120.0,SELENA,General Cargo Ship,2457.0,907.0,1970.0,Cameroon,,Yeya Shipping Ltd,Russia,Seatron Shipping Co Ltd,Solka Shipping Ltd,Seychelles,Aliaga,Turkey,2024-02-01,,
7612474.0,GAUJA,General Cargo Ship,1926.0,1284.0,1979.0,Cameroon,,Ingria Shipping Ltd,Russia,Ingria Shipping Ltd,Illyra AG,Marshall Islands,Aliaga,Turkey,2024-05-01,,
8726179.0,NEFTERUDOVOZ-52M,Ore/Oil Carrier,2615.0,1574.0,1985.0,Russia,,Metship Co Ltd,Russia,Metship Co Ltd,Metship Co Ltd,Russia,Aliaga,Turkey,2024-08-01,,
7941239.0,BARON,Ore/Oil Carrier,2615.0,1481.0,1980.0,Russia,,Metship Co Ltd,Russia,Metship Co Ltd,Atrio Group Ltd,"Virgin Islands, British",Aliaga,Turkey,2024-08-01,,
7119252.0,KRISTALL,Tank Cleaning Vessel,994.0,0.0,1972.0,Russia,,Gazpromneft Marine Bunker Ltd,Russia,Gazpromneft Marine Bunker Ltd,Gazpromneft Marine Bunker Ltd,Russia,Kerch,Ukraine,2024-02-01,,
9200392.0,HARMONY 1,Bulk Carrier,38646.0,10317.0,1999.0,Comoros,India,Dronfield Ltd,Samoa,Treasure Harvest Shipping Pvt,Treasure Harvest Shipping Pvt,India,Chittagong,Bangladesh,2024-10-01,,
7602106.0,AMANAH,Passenger/Ro-Ro Ship (Vehicles),19009.0,8996.0,1979.0,Saudi Arabia,,Nesma Holding Co Ltd,Saudi Arabia,Namma Shipping Lines,Namma International Trading,Saudi Arabia,Alang,India,2024-04-01,,
8314586.0,ATAR,Logistics Vessel (Naval Ro-Ro Cargo),16557.0,8920.0,1983.0,St Kitts & Nevis,Singapore,Kuo Fen Ching,Singapore,Singapore Govt Navy,Valour Offshore Marine Service,Singapore,Chittagong,Bangladesh,2024-05-01,,
8908765.0,PINE EXPRESS,Wood Chips Carrier,39145.0,9543.0,1990.0,Marshall Islands,,Nova Shipping & Logistics Pte,Singapore,Nova Shipping & Logistics Pte,Pine Express Pte Ltd,Singapore,Chittagong,Bangladesh,2024-06-01,,
9060247.0,SERENITY 1,Bulk Carrier,17430.0,6350.0,1994.0,Panama,,Feng Sea Shipping Pte Ltd,Singapore,Feng Sea Shipping Pte Ltd,Serenity Shipping Co Ltd-BVI,British Virgin Islands,Chittagong,Bangladesh,2024-09-01,,
9112557.0,IDM DOODLE,General Cargo Ship (with Ro-Ro facility),9992.0,4302.0,1995.0,Panama,,Rai A,Singapore,IDM Mana Pte Ltd,Mana Fonds Pte Ltd,Singapore,Alang,India,2024-06-01,,
6705432.0,DON LUCIANO,Fishing Vessel,648.0,0.0,1967.0,Argentina,,Irvin & Johnson Ltd,South Africa,Alpesca SA,Alpesca SA,Argentina,Mar del Plata,Argentina,2024-08-01,,
9141625.0,OCMIS GAR,General Cargo Ship,4150.0,2477.0,1997.0,Guinea-Bissau,,Ocmis Maritime SL,Spain,Hellenic Glamor Ship Mgmt LLC,Gar Maritime Co Ltd,Liberia,Alang,India,2024-05-01,,
9155406.0,OCMIS LEGENDS,General Cargo Ship,4115.0,2331.0,1998.0,Palau,,Ocmis Maritime SL,Spain,Legends Marine Navigation Co,Legends Marine Navigation Co,Liberia,Alang,India,2024-08-01,,
7710276.0,MONTECRUZ,Refrigerated Cargo Ship,2689.0,1457.0,1978.0,Panama,,CalvoPesca SA,Spain,CalvoPesca SA,Gestra Corp SA,Panama,Aliaga,Turkey,2024-08-01,,
8519382.0,LMS LAXAPANA,Products Tanker,1970.0,1205.0,1986.0,Sri Lanka,,Sri Lanka Shipping Co Ltd,Sri Lanka,Lanka Maritime Services Ltd,Lanka Maritime Services Ltd,Sri Lanka,Chittagong,Bangladesh,2024-03-01,,
9073062.0,MSC SOPHIE,Container Ship (Fully Cellular),37398.0,13616.0,1993.0,Panama,,MSC Mediterranean Shipping Co,Switzerland,MSC Mediterranean Shipping Co,Sophie Naviera Co SA,Panama,Alang,India,2024-01-01,,
9163192.0,MSC UMA,Container Ship (Fully Cellular),23722.0,10455.0,1998.0,Liberia,,MSC Mediterranean Shipping Co,Switzerland,MSC Mediterranean Shipping Co,Metis Oceanway Ltd,Liberia,Alang,India,2024-01-01,,
9190092.0,MSC EAGLE F,General Cargo Ship,12993.0,6878.0,2000.0,Liberia,,MSC Mediterranean Shipping Co,Switzerland,MSC Mediterranean Shipping Co,Skyeagle Oceanway Ltd,Liberia,Alang,India,2024-01-01,,
9051478.0,MSC JEMIMA,Container Ship (Fully Cellular),30971.0,12677.0,1994.0,Panama,,MSC Mediterranean Shipping Co,Switzerland,MSC Mediterranean Shipping Co,Jemima Marine Inc,Liberia,Alang,India,2024-01-01,,
9065443.0,MSC ROSSELLA,Container Ship (Fully Cellular),37398.0,13305.0,1993.0,Panama,,MSC Mediterranean Shipping Co,Switzerland,MSC Mediterranean Shipping Co,Rossella Maritime Inc,Liberia,Alang,India,2024-03-01,,
9051492.0,MSC NILGUN,Container Ship (Fully Cellular),30971.0,12553.0,1994.0,Panama,,MSC Mediterranean Shipping Co,Switzerland,MSC Mediterranean Shipping Co,Nilgun Maritime Inc,Liberia,Alang,India,2024-04-01,,
8918057.0,MSC GRACE F,General Cargo Ship,13258.0,7555.0,1991.0,Panama,,MSC Mediterranean Shipping Co,Switzerland,MSC Mediterranean Shipping Co,Grace Oceanway Ltd,Liberia,Alang,India,2024-06-01,,
8201624.0,MSC IRIS,Container Ship (Fully Cellular),21586.0,10655.0,1982.0,Panama,,MSC Mediterranean Shipping Co,Switzerland,MSC Mediterranean Shipping Co,Iris Oceanway Ltd,Liberia,Alang,India,2024-07-01,,
8521402.0,MSC ANNAMARIA,Container Ship (Fully Cellular),21633.0,8805.0,1987.0,Panama,,MSC Mediterranean Shipping Co,Switzerland,MSC Mediterranean Shipping Co,Annamaria Oceanway Ltd,Liberia,Alang,India,2024-08-01,,
9057173.0,MSC AGATA II,Container Ship (Fully Cellular),16202.0,7364.0,1994.0,Liberia,,MSC Mediterranean Shipping Co,Switzerland,MSC Mediterranean Shipping Co,Agata Oceanway Ltd,Liberia,Alang,India,2024-09-01,,
8413875.0,MSC GABRIELLA,Container Ship (Fully Cellular),21887.0,8911.0,1985.0,Panama,,MSC Mediterranean Shipping Co,Switzerland,MSC Mediterranean Shipping Co,Gabriella Oceanway Ltd,Liberia,Alang,India,2024-09-01,,
8512906.0,MSC ADELE,Container Ship (Fully Cellular),21633.0,8779.0,1986.0,Panama,,MSC Mediterranean Shipping Co,Switzerland,MSC Mediterranean Shipping Co,Adele Oceanway Ltd,Liberia,Alang,India,2024-10-01,,
8201648.0,MSC EYRA,Container Ship (Fully Cellular),21586.0,10655.0,1982.0,Panama,,MSC Mediterranean Shipping Co,Switzerland,MSC Mediterranean Shipping Co,Eyra Oceanway Ltd,Liberia,Alang,India,2024-10-01,,
9129873.0,MSC ALEXA,Container Ship (Fully Cellular),42307.0,16228.0,1996.0,Panama,,MSC Mediterranean Shipping Co,Switzerland,MSC Mediterranean Shipping Co,Abilear Corp,Panama,Alang,India,2024-10-01,,
9129885.0,MSC RAFAELA,Container Ship (Fully Cellular),42307.0,16024.0,1996.0,Panama,,MSC Mediterranean Shipping Co,Switzerland,MSC Mediterranean Shipping Co,Jacinia Holdings Inc,Panama,Alang,India,2024-11-01,,
8512891.0,MSC AUGUSTA,Container Ship (Fully Cellular),21648.0,8797.0,1986.0,Panama,,MSC Mediterranean Shipping Co,Switzerland,MSC Mediterranean Shipping Co,Augusta Oceanway Ltd,Liberia,Alang,India,2024-12-01,,
8401133.0,MAESTRO SUN,Ro-Ro Cargo Ship,15375.0,5200.0,1986.0,Marshall Islands,,Maestro Shipping SA,Switzerland,Maestro Shipping SA,Sun Inc,Marshall Islands,Aliaga,Turkey,2024-01-01,,
8201636.0,MSC MALIN,Container Ship (Fully Cellular),21586.0,10655.0,1982.0,Panama,,MSC Mediterranean Shipping Co,Switzerland,MSC Mediterranean Shipping Co,Malin Oceanway Ltd,Liberia,Aliaga,Turkey,2024-11-01,,
7374448.0,YONG FENG,Products Tanker,3738.0,2055.0,1975.0,Cameroon,St Kitts & Nevis,Unknown,Taiwan,Smile Winner Co Ltd,Smile Winner Co Ltd,Samoa,Chittagong,Bangladesh,2024-01-01,,
8025848.0,MENT 1,Cement Carrier,3917.0,2234.0,1980.0,St Kitts & Nevis,Taiwan,U-Ming Marine Transport Corp,Taiwan,U-Ming Marine Transport Corp,U-Ming Marine Transport Corp,Taiwan,Chittagong,Bangladesh,2024-05-01,,
9168855.0,URANUS,Container Ship (Fully Cellular),69246.0,24328.0,1999.0,Comoros,Panama,Evergreen Marine Corp,Taiwan,Evergreen Marine Corp,Greencompass Marine SA,Panama,Alang,India,2024-07-01,,
8122385.0,VIVA,Refrigerated Cargo Ship,3574.0,2188.0,1982.0,St Kitts & Nevis,Panama,Hua Fu Intl Group SA,Taiwan,Hua Fu Intl Group SA,Viva Marine SA,Panama,Alang,India,2024-07-01,,
9130585.0,UNI III,Container Ship (Fully Cellular),14807.0,7099.0,1999.0,Comoros,Panama,Evergreen Marine Corp,Taiwan,Evergreen Marine Corp,Gaining Enterprise SA,Panama,Alang,India,2024-10-01,,
9130597.0,SURE,Container Ship (Fully Cellular),14807.0,7099.0,1999.0,Togo,Panama,Evergreen Marine Corp,Taiwan,Evergreen Marine Corp,Gaining Enterprise SA,Panama,Aliaga,Turkey,2024-07-01,,
9016832.0,THARERATANA 1,Products Tanker,997.0,739.0,1990.0,Thailand,,Bangkok Bank,Thailand,BSL Leasing Co Ltd,BSL Leasing Co Ltd,Thailand,Chittagong,Bangladesh,2024-04-01,,
8819225.0,INTER STEVEDORING 8,"Bulk Carrier, Self-discharging",36540.0,11014.0,1989.0,Thailand,,Double A Power Group,Thailand,Highland Maritime Co Ltd,National Power Plant 3 Co Ltd,Thailand,Chittagong,Bangladesh,2024-05-01,,
8822258.0,PILATUS 21,LPG Tanker,933.0,890.0,1989.0,Thailand,,Pilatas Marine PCL,Thailand,Pilatas Marine PCL,Pilatas Marine PCL,Thailand,Chittagong,Bangladesh,2024-05-01,,
7904061.0,WILSON,Products Tanker,724.0,0.0,1979.0,Cameroon,Thailand,PK Group of Companies,Thailand,PC Marine 1992 Co Ltd,PC Marine 1992 Co Ltd,Thailand,Chittagong,Bangladesh,2024-05-01,,
8805822.0,PK 10,Products Tanker,1014.0,725.0,1988.0,Tanzania (Zanzibar),,Big Sea Co Ltd,Thailand,Big Sea Co Ltd,Big Sea Co Ltd,Thailand,Chittagong,Bangladesh,2024-10-01,,
8816998.0,THAILAEMTHONG 3,Products Tanker,1042.0,0.0,1988.0,Thailand,,Thailaemthong Supply,Thailand,Thailaemthong Fishery,Thailaemthong Fishery,Thailand,Chittagong,Bangladesh,2024-11-01,,
9145695.0,YILDIZLAR 2,Wood Chips Carrier,40328.0,10347.0,1996.0,Turkey,,Pasifik Lojistik Grubu,Turkey,Yildizlar Deniz Isletmeciligi,Yildizlar Deniz Isletmeciligi,Turkey,Chittagong,Bangladesh,2024-03-01,,
9108257.0,DENAK VOYAGER,Bulk Carrier,37663.0,9518.0,1996.0,Turkey,,Colakoglu Metalurji AS,Turkey,Denak Ship Management & Agency,Denak Ship Management & Agency,Turkey,Chittagong,Bangladesh,2024-04-01,,
9116319.0,NAHIDE-M,Bulk Carrier,18108.0,6984.0,1995.0,Panama,,Iskenderun Gemi Isletmeciligi,Turkey,Iskenderun Gemi Isletmeciligi,Yellow Funnel Shipping Ltd-MAI,Marshall Islands,Chittagong,Bangladesh,2024-08-01,,
8811390.0,IPEK,General Cargo Ship,12930.0,6751.0,2001.0,St Kitts & Nevis,Panama,Ozguclu A,Turkey,Oba Shipping Inc,Oba Shipping Inc,Turkey,Chittagong,Bangladesh,2024-09-01,,
9087233.0,FATMA SARI,Bulk Carrier,25503.0,8013.0,1994.0,Turkey,,Nazli Denizcilik Ltd Sti,Turkey,T ve O Denizcilik Ltd Sti,Nazli Denizcilik Ltd Sti,Turkey,Chittagong,Bangladesh,2024-11-01,,
9110901.0,ELA,Bulk Carrier,20837.0,8957.0,1996.0,Panama,Malta,Gamma Denizcilik Nakliyat,Turkey,Gamma Denizcilik Nakliyat,Epsilon Marine Co Ltd,Malta,Alang,India,2024-09-01,,
9106467.0,CASABLANCA A,Container Ship (Fully Cellular),8633.0,4666.0,1996.0,Morocco,,Arkas Holding AS,Turkey,Arkas Denizcilik ve Nakliyat,Maroc Feedering SA,Morocco,Aliaga,Turkey,2023-12-01,,
7816147.0,AMANOS,General Cargo Ship,1589.0,0.0,1978.0,Tanzania (Zanzibar),Palau,Bromarine Nakliyat ve Ticaret,Turkey,Bromarine Nakliyat ve Ticaret,Concorde Shipping Ltd,Marshall Islands,Aliaga,Turkey,2024-02-01,,
7429322.0,KALELI ANA,General Cargo Ship,3936.0,1700.0,1976.0,Comoros,,Caferoglu Denizcilik,Turkey,Caferoglu Denizcilik,Black Sea Maritime Ltd-MAI,Marshall Islands,Aliaga,Turkey,2024-04-01,,
8101537.0,AYHANLAR,General Cargo Ship,2765.0,0.0,1982.0,Turkey,,Ayhanlar Denizcilik Madencilik,Turkey,Ayhanlar Denizcilik Madencilik,Ayhanlar Denizcilik Madencilik,Turkey,Aliaga,Turkey,2024-04-01,,
7808097.0,NANDA C,General Cargo Ship,998.0,697.0,1981.0,Comoros,,CAKA Denizcilik Ltd,Turkey,Nanda Shipping Co,Nanda Shipping Co,Marshall Islands,Aliaga,Turkey,2024-05-01,,
6720066.0,CAGSAN,General Cargo Ship,954.0,840.0,1967.0,Turkey,,Savas Denizcilik,Turkey,Savas Denizcilik,Savas Denizcilik,Turkey,Aliaga,Turkey,2024-07-01,,
8125167.0,GUNDOGDU 1,General Cargo Ship,1598.0,0.0,1984.0,Turkey,,Arel Denizcilik Ticaret,Turkey,Arel Denizcilik Ticaret,Ada Denizcilik Fikri Akin,Turkey,Aliaga,Turkey,2024-08-01,,
8132598.0,KUDRET GEZER,General Cargo Ship,942.0,0.0,1979.0,Vanuatu,,Su Deryasi Denizcilik ve Tic,Turkey,Su Deryasi Denizcilik ve Tic,Su Deryasi Denizcilik ve Tic,Turkey,Aliaga,Turkey,2024-08-01,,
8811405.0,MUSA OBA,General Cargo Ship,12930.0,6769.0,2002.0,Panama,,Ozguclu A,Turkey,Hakan Shipping Inc,Hakan Shipping Inc,Marshall Islands,Aliaga,Turkey,2024-09-01,,
8970615.0,NAZIM IMAMOGLU,General Cargo Ship,978.0,0.0,1993.0,Turkey,,Dogru Denizcilik Brokerlik,Turkey,Dogru Denizcilik Brokerlik,Dogru Denizcilik Brokerlik,Turkey,Aliaga,Turkey,2024-11-01,,
7905649.0,MARIS 1,General Cargo Ship,2806.0,0.0,1989.0,Turkey,,Altay Maris Denizcilik Tas Hiz,Turkey,Altay Maris Denizcilik Tas Hiz,Altay Maris Denizcilik Tas Hiz,Turkey,Aliaga,Turkey,2024-11-01,,
9107679.0,ONE VICTORY,Bulk Carrier,26250.0,7685.0,1996.0,Panama,,Yasin GH,Ukraine,One Navigation Denizcilik AS,One Victory Corp,Marshall Islands,Chittagong,Bangladesh,2024-04-01,,
8865987.0,MILA,General Cargo Ship,2894.0,1581.0,1972.0,Togo,,Black Sea Shipping Management,Ukraine,Argo Shipping Co,Excelsior Shipping & Trading,Panama,Aliaga,Turkey,2024-09-01,,
8947620.0,FETIDA,General Cargo Ship,1866.0,750.0,1964.0,Moldova,,Poseidon Shipping Ltd-UKE,Ukraine,Poseidon Shipping Ltd-UKE,Poliservis,Ukraine,Aliaga,Turkey,2024-10-01,,
8311560.0,SUKRU OKAN,General Cargo Ship,2155.0,0.0,1989.0,Palau,,Kaalbye Shipping,Ukraine,OG Shipping Ltd,OG Shipping Ltd,Marshall Islands,Aliaga,Turkey,2024-10-01,,
8981080.0,MANCHESTER,General Cargo Ship,1652.0,0.0,1964.0,Ukraine,,Argo Shipping Co,Ukraine,Argo Shipping Co,CAS Shipping Ltd,St Vincent & The Grenadines,Aliaga,Turkey,2024-10-01,,
8723256.0,MANGUP,Fishing Vessel,2399.0,1736.0,1986.0,Unknown,,Linart Ltd,Ukraine,Linart Ltd,Linart Ltd,Ukraine,Aliaga,Turkey,2024-11-01,,
8965165.0,LIVERPOOL,General Cargo Ship,1837.0,0.0,1963.0,Comoros,Ukraine,Triton Fuels Ukraine,Ukraine,Triton Fuels Ukraine,United Trade Group Ltd,United States Of America,Aliaga,Turkey,2024-11-01,,
9278521.0,LILA NANTONG,Bulk Carrier,87590.0,23982.0,2003.0,Liberia,,Lila Global Ltd,United Arab Emirates,Lila Global Ltd,Essa Investments Ltd,Liberia,Chittagong,Bangladesh,2024-02-01,,
9190377.0,SIA,Bulk Carrier,40489.0,12605.0,1999.0,Liberia,,Lila Global Ltd,United Arab Emirates,Lexi Shipping Ltd,Lexi Shipping Ltd,Liberia,Chittagong,Bangladesh,2024-02-01,,
9138496.0,JULE,Bulk Carrier,38338.0,9726.0,1997.0,Panama,,Lila Global Ltd,United Arab Emirates,Mar Holding Ltd,Mar Holding Ltd,Liberia,Chittagong,Bangladesh,2024-11-01,,
9146285.0,SOL,Container Ship (Fully Cellular),8299.0,3870.0,1997.0,St Kitts & Nevis,Panama,Transworld Group,United Arab Emirates,Providence Ship Management IND,Liberty Navigation S Pte Ltd,United Arab Emirates,Alang,India,2024-01-01,,
7382988.0,ASPHALT PRINCESS,Asphalt/Bitumen Tanker,5746.0,3271.0,1976.0,Panama,,Prime Tankers LLC,United Arab Emirates,Glory International FZ-LLC,Asphalt Princess Shipping,Panama,Alang,India,2024-04-01,,
9217034.0,DELHI,Container Ship (Fully Cellular),25369.0,10669.0,2000.0,St Kitts & Nevis,India,Transworld Group,United Arab Emirates,Orient Express Lines Inc,Transworld Shipping Lines Ltd,India,Gadani,Pakistan,2024-01-01,,
9255012.0,WANG HAI,Bulk Carrier,88856.0,23039.0,2003.0,Liberia,,Lila Global Ltd,United Arab Emirates,Kyra Global Marine Services,Essa Investments Ltd,Liberia,Gadani,Pakistan,2024-02-01,,
9108659.0,OSCAR 1,General Cargo Ship,6641.0,2620.0,1995.0,Comoros,Togo,Oscar Dubai Shipping SA,United Arab Emirates,Oscar Middle East Ship Mgmt,Oscar Dubai Shipping SA,Honduras,Gadani,Pakistan,2024-03-01,,
8901808.0,QATAR ANA,Bulk Carrier,25891.0,8015.0,1989.0,Panama,,Al Khalejia Aggregates FZE,United Arab Emirates,Al Khalejia Aggregates FZE,Al Khalejia Marine Inc,Panama,Gadani,Pakistan,2024-03-01,,
9221229.0,VENIA,Bulk Carrier,87497.0,23118.0,2001.0,St Kitts & Nevis,Liberia,Lila Global Ltd,United Arab Emirates,Hermes Maritime Services Pvt,Neptune Seaway Ltd,Liberia,Gadani,Pakistan,2024-10-01,,
9007295.0,PRIDE OF CANTERBURY,Passenger/Ro-Ro Ship (Vehicles),30635.0,10385.0,1991.0,St Kitts & Nevis,,P&O,United Arab Emirates,P&O Ferries Ltd,P&O Ferries Ltd,United Kingdom,Aliaga,Turkey,2024-01-01,,
8811766.0,TOMSON GAS,LPG Tanker,3219.0,1991.0,1989.0,Panama,,Jmukhadze T,United Kingdom,Marine Shipping Line FZE,Zack Shipping SA,Panama,Alang,India,2024-01-01,,
7900596.0,CAPT. OSAMA,General Cargo Ship,9232.0,4326.0,1981.0,St Kitts & Nevis,Palau,Jaohar Group Ltd,United Kingdom,Cape Cruise Marine Ltd,Cape Cruise Marine Ltd,Liberia,Alang,India,2024-10-01,,
7814448.0,DILIGENCE,Work/Repair Vessel,8048.0,0.0,1981.0,Unknown,,United Kingdom Govt,United Kingdom,United Kingdom Govt CRFA,United Kingdom Govt,United Kingdom,Aliaga,Turkey,2024-04-01,,
8404501.0,ASTRID,Fishing Vessel,3413.0,0.0,1985.0,Belize,,Astrid Shipping Co Ltd-GBI,United Kingdom,Astrid Shipping Co Ltd-GBI,Astrid Shipping Co Ltd-GBI,United Kingdom,Aliaga,Turkey,2024-06-01,,
9114153.0,KONSTANTINOS,Bulk Carrier,25503.0,7979.0,1995.0,Panama,,MKM Chartering Inc,United States Of America,Mega Shipping Ltd,Konstantinos Shiptrade Inc,Marshall Islands,Chittagong,Bangladesh,2024-02-01,,
7528843.0,PIONEER,Pollution Control Vessel,1058.0,1348.0,1978.0,St Kitts & Nevis,United States of America,Resolve Marine Group Inc,United States of America,Resolve Pioneer LLC,Resolve Pioneer LLC,United States of America,Chittagong,Bangladesh,2024-07-01,,
8836273.0,GORDON,Fish Factory Ship,4807.0,2756.0,1943.0,St Kitts & Nevis,United States Of America,Icicle Seafoods Inc,United States Of America,Icicle Seafoods Inc,Coastal Star,United States Of America,Alang,India,2024-07-01,,
8751368.0,CEAN,"Drilling Rig, semi Submersible",21192.0,21963.0,1974.0,St Kitts & Nevis,Marshall Islands,Loews Corp,United States Of America,Niko Resources Ltd,Diamond Offshore Services Co,United States Of America,Alang,India,2024-11-01,,
7907647.0,FLIPPER,Ro-Ro Cargo Ship,4688.0,2013.0,1980.0,Sao Tome & Principe,Panama,Devon Shipping Inc,United States Of America,Fleet-In SA,Devon Shipping Inc,United States Of America,Aliaga,Turkey,2024-07-01,,
7325629.0,DIAMOND XI,Accommodation Ship,8282.0,4215.0,1974.0,Portugal (Mar),,Sunstone Ships Inc,United States Of America,Sunstone Ships Inc,Diamond Cruise Partners,Portugal,Aliaga,Turkey,2024-08-01,,
8220773.0,PAUL BUCK,Replenishment Tanker,21471.0,9028.0,1985.0,United States Of America,,United States Govt,United States Of America,United States Govt MARAD,United States Govt MARAD,United States Of America,Brownsville,United States of America,2024-02-01,,
8310097.0,SAMUEL L. COBB,Replenishment Tanker,21471.0,9055.0,1985.0,United States Of America,,United States Govt,United States Of America,United States Govt MARAD,United States Govt MARAD,United States Of America,Brownsville,United States of America,2024-02-01,,
8310102.0,RICHARD G. MATTHIESEN,Replenishment Tanker,21471.0,9485.0,1986.0,United States Of America,,United States Govt,United States Of America,United States Govt MARAD,United States Govt MARAD,United States Of America,Brownsville,United States of America,2024-02-01,,
8314158.0,LAWRENCE H. GIANELLA,Replenishment Tanker,21471.0,7211.0,1986.0,United States Of America,,United States Govt,United States Of America,United States Govt MSC,United States Govt MSC,United States Of America,Brownsville,United States of America,2024-04-01,,
5144485.0,CAPE JUBY,General Cargo Ship,12929.0,0.0,1962.0,United States Of America,,United States Govt,United States Of America,United States Govt MARAD,United States Govt MARAD,United States Of America,Brownsville,United States of America,2024-05-01,,
7823463.0,PFC. EUGENE A. OBREGON,Logistics Vessel (Naval Ro-Ro Cargo),45408.0,26965.0,1982.0,United States Of America,,United States Govt,United States Of America,United States Govt MSC,United States Govt MSC,United States Of America,Brownsville,United States of America,2024-06-01,,
7702762.0,ANDREW J. BARBERI,Passenger Ship,3335.0,0.0,1981.0,United States Of America,,New York City,United States Of America,New York City Transportation,New York City Transportation,United States Of America,Staten Island,United States of America,2024-09-01,,
7912123.0,MAJ. STEPHEN W. PLESS,Logistics Vessel (Naval Ro-Ro Cargo),45408.0,27031.0,1983.0,United States Of America,,United States Govt,United States Of America,United States Govt MSC,United States Govt MSC,United States Of America,Brownsville,United States of America,2024-11-01,,
8511495.0,WALTER S. DIEHL,Replenishment Tanker,20706.0,15735.0,1988.0,United States Of America,,United States Govt,United States Of America,United States Govt MSC,United States Govt MSC,United States Of America,Brownsville,United States of America,2024-12-01,,
7906837.0,ZION FALGOUT,Pusher Tug,675.0,0.0,1979.0,United States Of America,,Falgout Bros LLC,United States Of America,Global Towing Service LLC,Zion Falgout LLC,United States Of America,Unknown,Unknown,2024-03-01,,
9077903.0,WADI S,Bulk Carrier,37550.0,10247.0,1994.0,Comoros,,Unknown,Unknown,Kiva Marine Ltd-MAI,Tudor Maritime Ltd,Marshall Islands,Chittagong,Bangladesh,2024-02-01,,
9258105.0,ZEUS ONE,Bulk Carrier,88494.0,21364.0,2002.0,Liberia,,Unknown,Unknown,Athena Shipping Pte Ltd,Zeus Marine Ltd-LIB,Liberia,Chittagong,Bangladesh,2024-02-01,,
9144029.0,GOLD BRIDGE,Bulk Carrier,25537.0,7197.0,1998.0,Panama,,Unknown,Unknown,Kind Glory Shipping Co Ltd,DV Marine Ltd,Marshall Islands,Chittagong,Bangladesh,2024-11-01,,
9051741.0,RUN DE,General Cargo Ship,5782.0,3058.0,1993.0,Unknown,,Unknown,Unknown,Run De Shipping Co Ltd,Run De Shipping Co Ltd,Hong Kong,Guayaquil,Ecuador,2024-05-01,,
8402670.0,ACE 1,General Cargo Ship,998.0,0.0,1984.0,Unknown,,Unknown,Unknown,Unknown,Unknown,Unknown,Unknown,France,2024-02-01,,
5427784.0,WHITE PALM,Pilot Vessel,781.0,762.0,1963.0,Sao Tome & Principe False,Sierra Leone,Unknown,Unknown,Nemsa Services Ltd,Nemsa Services Ltd,British Virgin Islands,Alang,India,2023-12-01,,
9270804.0,ONYX 1,Container Ship (Fully Cellular),21932.0,10643.0,2004.0,Panama,,Unknown,Unknown,SIS Ship Charter LLC,Great Star Vision Ltd,"Virgin Islands, British",Alang,India,2024-01-01,,
8902838.0,AT MIDDLE BRIDGE,General Cargo Ship (with Ro-Ro facility),7624.0,3406.0,1989.0,Togo,,Unknown,Unknown,Middle Bridge Maritime Ltd-LIB,Middle Bridge Maritime Ltd-LIB,Liberia,Alang,India,2024-01-01,,
8826199.0,VILIGA,Fishing Vessel,776.0,807.0,1989.0,Mongolia,,Unknown,Unknown,Trade Bridge Inc Ltd,Trade Bridge Inc Ltd,Hong Kong ,Alang,India,2024-01-01,,
9539559.0,HASAN,General Cargo Ship,6524.0,3174.0,2009.0,Unknown,,Unknown,Unknown,Onal Gemi Isletmeciligi Sanayi,Bramco Shipping Ltd-MAI,Marshall Islands,Alang,India,2024-02-01,,
7610270.0,ALJAMIL,General Cargo Ship,4286.0,2128.0,1977.0,Comoros,Guyana,Unknown,Unknown,IMS Hellenic Co,Jamil Shipping Co SA,Belize,Alang,India,2024-03-01,,
9074030.0,NEW COURAGE,General Cargo Ship,8145.0,4426.0,1994.0,Panama,,Unknown,Unknown,Rightway Shipping Services,Starryway Co Ltd,Hong Kong,Alang,India,2024-05-01,,
8914697.0,UNITED ID,Bulk Carrier,22147.0,7173.0,1991.0,Palau,,Unknown,Unknown,Overseas Marine Ltd,Rising ID Martime Ltd,Marshall Islands,Alang,India,2024-06-01,,
9135535.0,RUDA,General Cargo Ship (Open Hatch),20398.0,5728.0,1996.0,Comoros,Panama,Unknown,Unknown,Fuwan Ship Management Co Ltd,Ruida Marine Co Ltd,Hong Kong,Alang,India,2024-08-01,,
9115092.0,ANDULUS 1,Bulk Carrier,16715.0,6064.0,1995.0,St Kitts & Nevis,,Unknown,Unknown,VRS Maritime Services Ltd,Andulus Marine Shipping Co,Marshall Islands,Alang,India,2024-10-01,,
8307947.0,TANA,General Cargo Ship,18977.0,7215.0,1985.0,St Kitts & Nevis,Sierra Leone,Unknown,Unknown,Delphina Shiptrade SA,Delphina Shiptrade SA,Marshall Islands,Alang,India,2024-10-01,,
7915307.0,ALI A,General Cargo Ship,4913.0,2578.0,1980.0,Togo,,Unknown,Unknown,Ammoun Shipping Co,Khaled Shipping Co,Liberia,Alang,India,2024-11-01,,
9014119.0,SOFI,Container Ship (Fully Cellular),8570.0,3732.0,1992.0,Comoros,Palau,Unknown,Unknown,Reel Shipping LLC,Ebro Shipping Inc,Marshall Islands,Alang,India,2024-11-01,,
8806905.0,MAHER,Heavy Load Carrier,6953.0,3519.0,1990.0,Tanzania (Zanzibar),,Unknown,Unknown,Hartland Marine Ltd,Westfield Marine Ltd,Liberia,Alang,India,2024-11-01,,
7812036.0,NEW SKY,Refrigerated Cargo Ship,3835.0,2410.0,1980.0,Dominica,,Unknown,Unknown,Poseidon Shipmanagement LLC,GC Shipping LP,United Kingdom,Alang,India,2024-12-01,,
8520202.0,SEAGRAND,General Cargo Ship,5998.0,3320.0,1986.0,Mongolia,,Unknown,Unknown,Cabotage Service Co Ltd-RUS,Rupa Holdings Co Ltd,Thailand,Alang,India,2024-12-01,,
8512865.0,PRINCE 4,Bulk Carrier,7110.0,2860.0,1986.0,Comoros,,Unknown,Unknown,Individual Shipping Ltd,Massa Shipping Co,Marshall Islands,Alang,India,2024-12-01,,
6724737.0,RIO 4,Trailing Suction Hopper Dredger,569.0,0.0,1967.0,Netherlands,,Unknown,Unknown,Unknown,Unknown,Unknown,Kampen,Netherlands,2024-03-01,,
7710501.0,SUNNFJORD,Passenger/Ro-Ro Ship (Vehicles),855.0,0.0,1978.0,Norway,,Unknown,Unknown,Fosen Gjenvining,Fosen Gjenvining,Norway,Stokksund,Norway,2024-03-01,,
9166417.0,BRAD,Crude Oil Tanker,56076.0,16368.0,1999.0,St Kitts & Nevis,,Unknown,Unknown,Global Tech Marine Services,Hallbar Ltd,British Virgin Islands,Gadani,Pakistan,2024-03-01,,
9047087.0,ALPS,Bulk Carrier,38136.0,10191.0,1994.0,Panama,,Unknown,Unknown,Shunping International Shpg,Evertop International Shipping,United Kingdom,Gadani,Pakistan,2024-06-01,,
